,en,fr,hypo,pplx,prec,rec
261,i made efforts to improve my grades .,私 は 成績 を 上げ る よう 努力 し た 。,i have to to _UNK _UNK _UNK . _EOS,16.177190464982584,0.3333333333333333,0.375
262,he laughed off his own bad reputation .,彼 は 自分 の 悪評 を 一笑 に 付 し た 。,he _UNK his his his his his . _EOS,40.02828718849899,0.3333333333333333,0.375
263,he told me a long story .,彼 は 私 に 長 い 物語 を 話 し て くれ た 。,he gave me me to to me me . _EOS,24.04781564779974,0.3,0.42857142857142855
264,"as long as it doesn &apos;t get cold , it &apos;s okay .",寒 く な り さえ し な けれ ば い い の で す 。,i &apos;d to to it it it it . . _EOS,82.48222808375333,0.2727272727272727,0.23076923076923078
265,i am acquainted with the custom .,私 は その しきたり を よく 知 っ て い る 。,i have the the the _UNK . _EOS,16.348208322838857,0.375,0.42857142857142855
266,the boy could not so much as write his own name .,その 少年 は 自分 の 名前 さえ 書 く こと が でき な かっ た 。,the could could not that his his . . _EOS,31.740661035952257,0.5,0.4166666666666667
267,nowadays many people live to be over seventy years old .,今日 で は ７０ 歳 以上 まで 生き る 人 は 多 い 。,we are to to not to it than than than . . . _EOS,60.99569957139994,0.14285714285714285,0.18181818181818182
268,her beautiful dress drew my attention .,彼女 の 美し い 服 が 私 の 注意 を 引 い た 。,i was a good of my . . _EOS,35.502076372908704,0.2222222222222222,0.2857142857142857
269,we shall start after breakfast .,朝食 後 、 出発 し ま しょ う 。,let &apos;s eat the . _EOS,23.92828747821434,0.16666666666666666,0.16666666666666666
270,at times i feel like quitting my job .,私 は ときどき 仕事 を やめ た い 気 が する 。,i am to the the the . . _EOS,168.08625315729915,0.2222222222222222,0.2222222222222222
271,how did it come out ?,結果 は どう な り ま し た か 。,have have you finished for ? ? _EOS,18.78362994917505,0.125,0.16666666666666666
272,you are trusted by every one of us .,あなた は 私 たち の 誰 から も 信頼 さ れ て い る 。,you are us of of us . _EOS,34.20057171810024,0.625,0.5555555555555556
273,the report revealed that many teenagers are alcoholics .,その 報告 書 から １０ 代 の 多く の 子供 が アルコール 中毒 に かか っ て い る こと が 分か っ た 。,the had had _UNK _UNK _UNK _UNK _UNK _UNK the . . . _EOS,37.20070428198413,0.14285714285714285,0.2222222222222222
274,"he flew to chicago , where he happened to see a friend .",彼 は シカゴ に 飛 ん だ 。 そして そこ で たまたま あ る 友人 に 会 っ た 。,he had that at at at at a for for for . . . _EOS,33.86546954208341,0.2,0.23076923076923078
275,please leave me alone .,私 を 一人 に し て お い て くださ い 。,please yourself to to . . _EOS,12.631711938813092,0.2857142857142857,0.4
276,"tamori was born in 1945 , that is , when world war ii ended .",田森 は 、 １９４５ 年 すなわち 第 二 次 世界 大戦 が 終わ っ た 年 に 生まれ た 。,_UNK _UNK _UNK _UNK _UNK _UNK _UNK _UNK _UNK _UNK _UNK _UNK _UNK _UNK . . _EOS,27.44345077801626,0.058823529411764705,0.06666666666666667
277,beware of thefts in a big city .,都会 で は 泥棒 に 気 を つけ な さ い 。,_UNK is not in in on . . _EOS,25.66087620037716,0.2222222222222222,0.25
278,he easily gets angry at trivial things .,彼 は ちょっと し た こと で すぐ 怒 る 。,he is been he he he is a . _EOS,63.128971048975714,0.2,0.25
279,he walked all the way home .,彼 は 、 家 まで ずっと 歩 い た 。,he was been to home . . _EOS,13.277075314895919,0.375,0.42857142857142855
280,her kind action strongly impressed me .,彼女 の 親切 な 行為 に 私 は 強 く 心 を 動か さ れ た 。,her _UNK was me me . . _EOS,26.81642945071886,0.375,0.42857142857142855
281,women ought to be as glad to be women as men are to be men .,女 は 女 で あ る こと を 、 男 が 男 で あ る こと を 喜 ぶ よう に 喜 ぶ べ き で あ る 。,"the is not to to , , the is is as . . _EOS",46.16486107160087,0.2857142857142857,0.25
282,it will be ready soon .,すぐ に 出来 ま す 。,i will soon to here here . . . _EOS,16.853726069648516,0.3,0.5
283,"by the time you come back , i &apos;ll be gone .",きみ が もど っ て 来る ころ に は 、 ぼく は 出かけ て しま っ て い る よ 。,"i &apos;m , , , , , , to in in . . . _EOS",51.31744403548703,0.2,0.25
284,"the last time i went to china , i visited shanghai .",この 前 中国 へ 行 っ た とき 、 上海 を 訪れ た 。,i went to the went went went to to i to . . . . . . _EOS,40.98416297993113,0.3333333333333333,0.5
285,we must wait for a few weeks to see the lilacs .,ライラック の 花 を 見 る に は ２、３ 週間 待 た ね ば な ら な い 。,you must to _UNK _UNK _UNK _UNK _UNK _UNK _UNK _UNK . _EOS,22.57192283895026,0.23076923076923078,0.25
286,it began to dawn .,夜 が 明け 始め た 。,the sky has in in . . _EOS,282.2287463060109,0.125,0.2
287,democracy will be victorious in the long run .,けっきょく 、 民主 主義 が 勝利 を 得 る だ ろ う 。,"we can a _UNK , _UNK _UNK the the . . _EOS",20.15132909045431,0.16666666666666666,0.2222222222222222
288,the two countries negotiated a treaty .,両国 は 条約 を 取り決め た 。,the _UNK _UNK his _UNK . _EOS,12.70811625530138,0.2857142857142857,0.2857142857142857
289,i don &apos;t feel like eating now .,私 は 今 食べ る 気 に な ら な い 。,i don not to to . . _EOS,12.740893822045106,0.375,0.375
290,is there anything else you want me to do ?,何 か 他 に 僕 に し て 欲し い こと は な い で す か 。,do you you to to to to with a ? ? _EOS,22.082685876163808,0.3333333333333333,0.4
291,he has collected twice as many stamps as i have .,彼 は 切手 を 私 の 二 倍 集め て い る 。,he is with of of his . . _EOS,307.19868527945545,0.2222222222222222,0.18181818181818182
292,"later , chris felt ashamed and apologized and beth forgave him .",後 に な っ て 、 クリス は 自分 の 行い を 恥ずかし く 思 い 、 彼女 に 謝 る と 、 ベス は 彼 を 許 し て くれ ま し た 。,"in , , , the the the was , she she , in to her him . . _EOS",203.98142612642883,0.15789473684210525,0.25
293,you should on no account cheat in the exam .,決して カンニング を し て は いけ ま せ ん 。,you can &apos;t _UNK the _UNK . . _EOS,35.635190035630785,0.3333333333333333,0.3
294,the boy lay listening to the radio .,少年 は ラジオ を 聞き ながら 横 に な っ て い た 。,the boy was in to the . . _EOS,11.629200446488467,0.5555555555555556,0.625
295,how long is the rainbow bridge ?,レインボウ ブリッジ の 長 さ は どの くらい で す か 。,how _UNK the _UNK _UNK _UNK ? ? _EOS,9.43248874448789,0.3333333333333333,0.42857142857142855
296,he is too dumb to fear danger .,あいつ は 馬鹿 だ から 、 怖 い も の 知 ら ず だ 。,the is is and and and and and . . . _EOS,88.62206273630925,0.16666666666666666,0.25
297,she forced me to go out with her .,彼女 は 強制 的 に 私 を 一緒 に 連れ出 し た 。,she made me for a _UNK _UNK . _EOS,18.22572573842206,0.3333333333333333,0.3333333333333333
298,i looked for someone to take her place .,私 は 誰 か が 彼女 の 代わり を する 人 を 探 し た 。,i saw a of of her her . _EOS,29.080915515291874,0.3333333333333333,0.3333333333333333
299,you will not get there on time .,時間 通り に は 着け な い よ 。,no &apos;s no a to a time time . . _EOS,22.749807918375254,0.18181818181818182,0.25
300,mr kennedy pointed out our mistakes .,ケネディ 氏 は 、 私 達 の ミス を 指摘 し ま し た 。,_UNK _UNK _UNK _UNK in the the . _EOS,97.78839365552828,0.1111111111111111,0.14285714285714285
301,he has taken to gardening .,彼 は 庭 いじり を する よう に な っ た 。,he had to his to the the the . . _EOS,113.63531245614938,0.2727272727272727,0.5
302,you had to study english .,英語 を 勉強 し な けれ ば な ら な かっ た 。,i had to to english . . _EOS,5.801089450394203,0.5,0.6666666666666666
303,there was eternal twilight in the place .,そこ に は 消え る こと の な い 薄明かり が あ っ た 。,there had no there there there . _EOS,15.879150544475529,0.25,0.25
304,i &apos;m glad to see you .,私 は あなた に あえ て うれし い 。,i am your you you . _EOS,7.643386601014923,0.42857142857142855,0.42857142857142855
305,the fisherman cast his line into the water .,漁師 は 釣り糸 を 水中 に 投げ た 。,the _UNK _UNK his _UNK . _EOS,33.88753317994526,0.42857142857142855,0.3333333333333333
306,this morning it was much cooler than yesterday morning .,今朝 は 昨日 の 朝 より も ずっと 涼し かっ た 。,i have to to this this this this . _EOS,36.99807830014369,0.2,0.2
307,bill has the makings of an excellent scientist .,ビル は 優秀 な 科学 者 に な る 素質 を 持 っ て い る 。,the has a a a a . . . _EOS,15.264707696221052,0.3,0.3333333333333333
308,she has a good command of english though she was brought up in japan .,彼女 は 日本 で 育 っ た に も かかわ ら ず 、 英語 を 自由 に 使 い こな す 。,she is she to to for for for for for in . . _EOS,61.86525303568755,0.2857142857142857,0.26666666666666666
309,"i know him by name , but not by sight .",あの 人 は 顔 は 知 ら な い が 名前 は 知 っ て い る 。,that can can he he is not . _EOS,143.40741408961196,0.2222222222222222,0.18181818181818182
310,jane kicked at our decision .,ジェーン は 私 たち の 決定 に 反対 し た 。,we were our our our . . _EOS,26.94639774396751,0.25,0.3333333333333333
311,he keeps a small poultry yard .,彼 は 小さな 鶏舎 を 持 っ て い る 。,he has his _UNK _UNK . _EOS,13.04787756643201,0.2857142857142857,0.2857142857142857
312,"keep your eyes wide open before marriage , half shut afterwards .",結婚 前 は 両眼 を 大き く 見開 い て おれ 、 その 後 は 、 その 半ば を 閉じ よ 。,the is _UNK _UNK _UNK _UNK _UNK _UNK _UNK _UNK _UNK _UNK _UNK . . . _EOS,402.9608516627979,0.058823529411764705,0.08333333333333333
313,i left my hat as i got off the train .,電車 を 降り た とき に 帽子 を 忘れ た 。,i had i had the the when the the the . _EOS,20.635955248947266,0.3333333333333333,0.36363636363636365
314,tom &apos;s friends called him mr money bags .,トム の 友達 は 彼 の こと を 「 マネー バッグ 」 と 呼 ん だ 。,his don _UNK to to to his _UNK . . _EOS,142.26383308582206,0.09090909090909091,0.1111111111111111
315,he was so childish that he couldn &apos;t resist temptation .,彼 は あまり に 子供 だ から 誘惑 に かて な かっ た 。,he was no from from a . . _EOS,63.009287574598254,0.3333333333333333,0.2727272727272727
316,are there any discount tickets for me ?,何 か 割引 切符 は あ り ま す か 。,have you you ? ? _EOS,124.77534867000729,0.16666666666666666,0.125
317,he turned a deaf ear to my advice .,彼 は 我々 の 忠告 に 耳 を 貸 さ な かっ た 。,he was not to to . . _EOS,33.052299829070215,0.375,0.3333333333333333
318,i read at least one book every month .,私 は 少な く とも 毎月 １ 冊 は 本 を 読 み ま す 。,i like to the the the the . . _EOS,15.933435841062252,0.2,0.2222222222222222
319,my sister cheers young sumo wrestlers .,姉 は 若 い 力士 を 応援 し て い ま す 。,i &apos;m looking on on on a . _EOS,87.57982351668176,0.1111111111111111,0.14285714285714285
320,but his friends call him ken .,しかし 彼 の 友達 は 彼 を ケン と 呼 ぶ 。,his his his his his his his . . _EOS,77.42121874388685,0.2,0.2857142857142857
321,she complained to him that it was too short a notice .,彼女 は 、 それ は あまり に 急 な 知ら せ だ と 彼 に ぐち を こぼ し た 。,she _UNK him to the the the . . _EOS,53.34601141250201,0.4,0.3333333333333333
322,turn off the television . i can &apos;t concentrate .,気 が 散 る から テレビ を 消 し て く れ 。,the _UNK will the the the the the . . _EOS,41.19046071005359,0.2727272727272727,0.3
323,who knows ?,誰 が 知 る もの か 。,who can you some ? _EOS,71.22859426260587,0.3333333333333333,0.6666666666666666
324,my little brother asked for some money .,弟 が お 金 を 頂戴 と 言 い ま し た 。,i had the money money money money . _EOS,34.13495146377922,0.2222222222222222,0.25
325,it will make for the society .,それ は 社会 に 寄与 する の だ 。,it &apos;s a to for for . _EOS,16.684748640547824,0.375,0.42857142857142855
326,i had my picture taken .,私 は 私 の 写真 を と っ て もら い ま し た 。,i was my my my my . _EOS,29.43491425827941,0.375,0.5
327,he paid me a compliment .,彼 は 私 に お 世辞 を 言 っ た 。,he said me me me . _EOS,3.5039751532761327,0.42857142857142855,0.5
328,we have got to get him to take that project seriously .,あの プロジェクト に つ い て 彼 を 本気 に さ せ な い と 。,you should not him him his his . . _EOS,151.56500241302538,0.2,0.16666666666666666
329,there is nobody who fulfils these conditions .,この 条件 に 該当 する 人 は 誰 も い な い 。,there is no _UNK to to the the the . . _EOS,57.02383778017643,0.25,0.375
330,are you the prophet ?,あなた は 預言 者 で す か 。,do you _UNK a ? _EOS,3.518517595397986,0.3333333333333333,0.4
331,let sleeping dogs lie .,眠れ る 獅子 は 起こ す な 。,"i can _UNK to , a _UNK . . _EOS",2280.570150603495,0.1,0.2
332,i think most people are better off now than they used to be .,たいてい の 人 が 以前 より も 暮らし 向き が よ い と 思 う 。,i think a is more than than than than than than than . . _EOS,45.23282183419024,0.26666666666666666,0.2857142857142857
333,let &apos;s talk it out .,話 を つけ よう じゃ な い か 。,don &apos;t you me me ? ? _EOS,53.4945367843671,0.0,0.0
334,have you read today &apos;s paper ?,今日 の 新聞 は 読 み ま し た か 。,have you you your in ? ? _EOS,10.62037093555119,0.375,0.42857142857142855
335,i insist on your being present .,私 は あなた に ぜひ 出席 し て もら い た い 。,i want you you you you you you . _EOS,199.11622526057783,0.2,0.2857142857142857
336,thank you very much for your thoughtful present .,心づくし の 品 を 頂き ありがとう ござ い ま す 。,_UNK is the the the the _UNK _UNK . _EOS,53.1692968062636,0.1,0.1111111111111111
337,beth was always up a tree .,ベス は いつ も 途方 に くれ て い た 。,i am always always with . . _EOS,20.799521860421038,0.25,0.2857142857142857
338,new york is the busiest city in the world .,ニューヨーク は 世界 で 最も にぎやか な 街 だ 。,_UNK is a in in in the _UNK . . _EOS,16.217043624174963,0.36363636363636365,0.4
339,it follows from this that the company is not responsible for the accident .,この こと から 、 会社 に は 事故 の 責任 が 無 い こと に な る 。,"this to is the , , to to the the the the the . . . _EOS",51.83414116427376,0.29411764705882354,0.35714285714285715
340,there was no one but wept to hear the story .,その 話 を 聞 い て 泣 か な い 人 は い な かっ た 。,you had not to to the the . . _EOS,42.72352843493333,0.3,0.2727272727272727
341,mary really takes after her mother .,メアリー は 母親 に 良く 似 て い る 。,there is to to for . . _EOS,32.95874628967201,0.125,0.14285714285714285
342,i beat him at golf .,私 は ゴルフ で 彼 を 負か し た 。,i _UNK him in the . . _EOS,24.355618821562313,0.375,0.5
343,the last wound proved fatal .,最後 の 傷 が 致命 的 で あ る と わか っ た 。,the _UNK _UNK _UNK _UNK _UNK _UNK the . . _EOS,84.39472439807054,0.18181818181818182,0.3333333333333333
344,mr frost is eligible for the post .,フロスト 氏 は その 地位 に つ く 資格 が あ る 。,_UNK _UNK is the the the . . _EOS,47.70374851599882,0.3333333333333333,0.375
345,a number of passengers were injured in the accident .,その 事故 で たくさん の 乗客 が けが し た 。,we were a of the the the . . _EOS,35.27532857721575,0.5,0.5
346,i plan to go skiing with my girlfriend .,僕 は ガール フレンド と 一緒 に スキー に 行 く 予定 で す 。,i &apos;ll to to the a next on . . _EOS,31.054698101892132,0.2727272727272727,0.3333333333333333
347,the automobile industry is one of the main industries in japan .,自動 車 産業 は 日本 の 大きな 産業 の ひと つ で あ る 。,the is are of of _UNK _UNK _UNK . _EOS,48.145044778686604,0.4,0.3333333333333333
348,some speculators take advantage of the ignorance and helplessness of old people .,相場 師 の 中 に は 老人 の 無知 と 寂し さ に 付け込 む 奴 が い る 。,in _UNK _UNK _UNK _UNK _UNK _UNK _UNK _UNK _UNK _UNK _UNK _UNK _UNK _UNK _UNK _UNK _UNK _UNK _UNK,59.15271544538472,0.0,0.0
349,we can just about read each other &apos;s minds .,彼 と 僕 は ツーカー の 仲 だ 。,what he he a a of . . _EOS,310.05627151666386,0.1111111111111111,0.1
350,the troops maintained their ground .,部隊 は 陣地 を 守 り 続け た 。,_UNK _UNK _UNK _UNK _UNK . . _EOS,28.503570703771263,0.125,0.16666666666666666
351,marry first and love will follow .,まず 結婚 しろ 。 そう すれ ば 愛情 と は あと で 生まれ て くる 。,"if the is , , , , , you you and and and and and and . . _EOS",528.6704453064672,0.10526315789473684,0.2857142857142857
352,"besides being ignorant , he is too proud .",彼 は 無知 で あ る 上 に 、 傲慢 で も あ る 。,"he is a , , , is a . . _EOS",83.99963163928797,0.36363636363636365,0.4444444444444444
353,you &apos;d better go there on foot .,そこ に は 歩 い て 行 っ た 方 が い い よ 。,you had better go go to there . . _EOS,5.877406144850658,0.5,0.625
354,it was careless of you to miss the bus .,バス に 乗り 遅れ る なんて 君 は 不 注意 だっ た ね 。,it was that that to to the the bus . _EOS,10.59365745869974,0.5454545454545454,0.6
355,in my analysis i rely considerably on the types of authoritarian behaviour first analyzed by kurz .,分析 に お い て は 、 クルツ に よ っ て 最初 に 分析 さ れ た 権威 的 行動 の 類型 に 負 っ て い る 部分 が 大き い 。,it &apos;s no _UNK in in in the the in the in in is _UNK . _EOS,45.26535125693914,0.17647058823529413,0.17647058823529413
356,when will you be free ?,君 は いつ 暇 に な り ま す か 。,has you you with . ? _EOS,10.559712916908548,0.2857142857142857,0.3333333333333333
357,let &apos;s get together tomorrow .,明日 集ま り ま しょ う 。,i &apos;ll tomorrow . . _EOS,18.56886678113557,0.3333333333333333,0.3333333333333333
358,you really put that much in the sandwich ?,そんな に 沢山 パン に 乗 る ん か？,he get get out _UNK _UNK . . _EOS,35.21667956180816,0.0,0.0
359,he is a proficient pianist .,彼 は 熟練 の ピアニスト だ 。,he is a _UNK _UNK . _EOS,3.87585517051721,0.5714285714285714,0.6666666666666666
360,i cannot help falling in love with you .,私 は あなた を 好き に な ら ず に は い られ な い 。,i cannot not to to . . _EOS,56.281396278215695,0.375,0.3333333333333333
361,i think the thai food at this place is seasoned so japanese will like it .,やはり 、 ここ の タイ 料理 の 味付け は 、 日本 人 好み に し て あ る ん だ ね 。,"the _UNK of of , the , the the the _EOS",68.69620735436999,0.09090909090909091,0.0625
362,his depression came to an end when she kissed him .,彼 の 憂うつ は 彼女 が キス を する と 晴れ た 。,his _UNK _UNK his his _UNK . . _EOS,73.73751929377394,0.2222222222222222,0.18181818181818182
363,"jane didn &apos;t play tennis , did she ?",ジェーン は テニス を し ま せ ん で し た ね 。,i don &apos;t you in in a . . _EOS,52.293267527449714,0.1,0.1111111111111111
364,give me something to eat .,私 に 何 か 食べ物 を 下さ い 。,give me me me me . _EOS,5.164108477146083,0.42857142857142855,0.5
365,we watch television every evening .,私 達 は 毎晩 テレビ を 見 る 。,we are _UNK _UNK . _EOS,45.63205138248756,0.3333333333333333,0.3333333333333333
366,"as soon as we get the answer , we &apos;ll phone you .",僕 たち に 答え が わか っ た ら すぐ に 君 に 電話 する よ 。,we will when when when when the the the . . _EOS,36.63323672384874,0.25,0.23076923076923078
367,what we need now is a rest .,今 私 たち に 必要 な の は 休息 で す 。,what are not are to to . . _EOS,16.726913006105825,0.2222222222222222,0.25
368,i don &apos;t think we should do that .,そう する べ き で は な い と 思 う 。,you think you you you you you not . . _EOS,10.00460579310079,0.18181818181818182,0.2222222222222222
369,i came to the conclusion that i had been deceived .,私 は だま さ れ て い た の だ と い う 結論 に 達 し た 。,i _UNK to to to the was . _EOS,67.44491719786704,0.4444444444444444,0.36363636363636365
370,i met ken yesterday .,昨日 ケン に 会 っ た 。,i met yesterday yesterday . _EOS,6.011423106237259,0.6666666666666666,0.8
371,"insure it , please .",保険 を かけ て 下さ い 。,give me me the the . _EOS,71.95641278141318,0.14285714285714285,0.2
372,have a nice vacation .,良 い 休暇 を 。,a a a a a . . _EOS,82.68178790172445,0.25,0.4
373,we found out recently that some foxes live here on this mountain .,この 山 に は 狐 が 住 ん で い る と い う こと が 最近 わか っ た 。,this had _UNK to be be be . . _EOS,87.86971872334856,0.2,0.15384615384615385
374,he was too tired to walk any more .,彼 は 疲れ すぎ て い て もう それ 以上 歩け な かっ た 。,he was no to to it . _EOS,7.724070741012215,0.5,0.4444444444444444
375,plants are nourished by earth .,植物 は 土壌 で 育 つ 。,this is _UNK in . . _EOS,22.67757532322051,0.14285714285714285,0.16666666666666666
376,he suffered a nervous breakdown .,彼 は 神経 衰弱 に な っ て い た 。,he was not the . . _EOS,17.460226926622738,0.2857142857142857,0.3333333333333333
377,miho is the girl i like best .,ミホ は 私 が 一番 好き な 女の子 で す 。,_UNK _UNK is a but _UNK . . _EOS,24.73000313364881,0.2222222222222222,0.25
378,he seems to be rich .,彼 は 金持ち で あ る よう に 思 わ れ る 。,he &apos;s be to be . . _EOS,10.10116607025008,0.5,0.6666666666666666
379,john claimed that the dishonest salesman had tricked him into buying a useless piece of machinery .,ジョン は 、 その 不 誠実 な セールスマン が 、 彼 を だま し て 無用 な 機械 を 買 わ せ た と 主張 し た 。,"john had the could was , , could could could the the . . _EOS",77.59506880450508,0.26666666666666666,0.23529411764705882
380,i shudder to think of it .,それ を 考え る と ぞっと する 。,it you it it it it . _EOS,9.313050570787091,0.25,0.2857142857142857
381,his life is free from care .,彼 の 生活 は 心配 が な い 。,he has no nothing to . . _EOS,27.527485865437388,0.125,0.14285714285714285
382,"drive more carefully , or you will run into trouble .",もっと 注意 深 く 運転 し な けれ ば 、 事故 に 巻き込 ま れ ま す よ 。,"if you you , , , , , you you in . . _EOS",68.23072586944728,0.21428571428571427,0.2727272727272727
383,there is a strong presumption against its truth .,それ が 間違 っ て い る 可能 性 が 非常 に 強 い 。,it that that that that is a it . . . _EOS,85.32354860818735,0.25,0.3333333333333333
384,i am badly in need of your help .,私 は あなた の 助け が とても 必要 で す 。,i am to to my . . _EOS,97.27188188957355,0.375,0.3333333333333333
385,she was transferred from the head office to a branch office last month .,彼女 は 先月 本社 から 支社 へ 転勤 さ せ られ た 。,she was _UNK _UNK _UNK _UNK _UNK _UNK _UNK _UNK . . _EOS,34.34834046242649,0.23076923076923078,0.21428571428571427
386,"i met the man , who showed me the way .",私 は その 男 に 会 っ た 。 する と 彼 は 私 に 道 を 教え て くれ た 。,he asked me me to the the to the the the the the . _EOS,47.720321039173314,0.26666666666666666,0.36363636363636365
387,what slips in and out of view in the background is the real estate slump of recent years .,背後 に 見え隠れ する の は 近年 の 不 動産 不況 だ 。,_UNK _UNK _UNK _UNK _UNK is to _UNK _UNK . _EOS,58.823961377087954,0.18181818181818182,0.10526315789473684
388,she painted the wall red .,彼女 は その 塀 を 赤 く 塗 っ た 。,she got the the the . _EOS,16.6610138278574,0.42857142857142855,0.5
389,they had to clean out the goods in stock within the year .,彼 ら は 年内 に 在庫 品 の かた を つけ な けれ ば な ら な かっ た 。,they had to _UNK the the the the the _UNK . _EOS,39.9245565182227,0.5,0.46153846153846156
390,carlos climbed the mountain .,カルロス は 山 を 登 っ た 。,the _UNK made a a a . . _EOS,301.12609783773,0.2222222222222222,0.4
391,i don &apos;t know any french .,私 は フランス 語 は 少し も 知 ら な い 。,i don not not a a . . _EOS,6.934959931739924,0.3333333333333333,0.42857142857142855
