,en,fr,hypo,pplx,prec,rec
130,i don &apos;t know how to cook too many things .,料理 の レパートリー は 限 ら れ て る の 。,the _UNK are are _UNK . _EOS,3261.5161811622593,0.14285714285714285,0.09090909090909091
131,what heading does this book come under ?,この 本 は 何 の 項目 に 入 り ま す か 。,what this book this book this this ? _EOS,26.080390916184474,0.4444444444444444,0.5
132,he finally made up his mind to marry the girl he had met in paris .,彼 は パリ 出会 っ た 女性 と 結婚 する 決心 を し た 。,he had a had when when when he again . . _EOS,104.8160399314422,0.3333333333333333,0.25
133,he bothered her with questions .,彼 は 彼女 に うるさ く 質問 し て 困 ら せ た 。,he had me at at the the the . . _EOS,95.69956893765944,0.18181818181818182,0.3333333333333333
134,can you direct me to the nearest subway station ?,最寄り の 地下 鉄 へ 行 く 道 を 教え て くれ ま せ ん か 。,will you me me the the the the the ? ? _EOS,14.8542706239445,0.3333333333333333,0.4
135,"after all is said and done , he was a first @-@ rate novelist .",彼 は 結局 は 一流 の 小説 家 で あ っ た 。,he was a _UNK of _UNK _UNK _UNK . _EOS,227.19003354025278,0.4,0.26666666666666666
136,drivers must observe the traffic rules .,運転 者 は 交通 規則 を 守 ら ね ば な ら な い 。,you must have the the the the . . _EOS,39.019209605270404,0.3,0.42857142857142855
137,he is not so much a politician as a merchant .,彼 は 政治 家 と い う より も むしろ 商人 だ 。,he is better than than is is . . _EOS,50.578708876704546,0.3,0.2727272727272727
138,he acceded to my proposal .,彼 は 私 の 提案 に 同意 し た 。,he gave to my my . . _EOS,7.3162864032889425,0.5,0.6666666666666666
139,don &apos;t press your opinion on me .,自分 の 考え を 僕 に 押しつけ る な 。,don &apos;t help your of his . . _EOS,12.415359949014714,0.4444444444444444,0.5
140,he played tennis .,彼 は テニス を し た 。,he gave his . . _EOS,11.233433269211648,0.3333333333333333,0.5
141,back into the hole where i was born .,薄汚 い 生まれ た 故郷 の 街 に 戻 っ て き た 。,i was a to to to the a the the . . _EOS,136.43394440824594,0.3076923076923077,0.4444444444444444
142,the car ran into a guardrail .,車 は ガードレール に 衝突 し た 。,the car _UNK _UNK in _UNK . _EOS,5.485021199937285,0.375,0.42857142857142855
143,there are enough accidents without asking for one .,注意 し て い て も 事故 は いろいろ 起き て い ま す から ね 。,"it it was a a , , i i , a a . _EOS",224.27504087913206,0.07142857142857142,0.1111111111111111
144,neither of his students passed the exam .,彼 の 教え子 の 中 で その 試験 に 合格 し た 者 は い な かっ た 。,it was no not the his his his his . . _EOS,260.77777896571064,0.25,0.375
145,my tape recorder is compatible with your amplifier .,私 の テープ レコーダー は 君 の アンプ に も つなげ られ る 。,my _UNK _UNK _UNK _UNK _UNK _UNK . _EOS,4.672066815088315,0.2222222222222222,0.2222222222222222
146,he was injured in a railway accident .,彼 は 列車 事故 で けが を し た 。,he took a the in in . . _EOS,15.726282411969441,0.4444444444444444,0.5
147,the batter struck out swinging .,バッター は 空振り の 三振 を し た 。,_UNK _UNK _UNK the _UNK . _EOS,9.152195462738565,0.2857142857142857,0.3333333333333333
148,"death is certain to all , all shall die .",死 は 万 人 に 来る べ き もの 、 すべて 人 は 死 す べ き もの な り 。,"it is to to to , , , , and and are . . _EOS",110.7689177838458,0.26666666666666666,0.4
149,i really enjoyed myself tonight .,今日 は 楽し かっ た 。,i was it to today . _EOS,35.634180275573144,0.2857142857142857,0.3333333333333333
150,i had written the letter when he came .,彼 が 来 た とき は 私 は その 手紙 を 書 き 終え て い た 。,he had that when he when he had . _EOS,14.879777513667925,0.4,0.4444444444444444
151,"then , at last , the policeman lowered his arm .",そして 、 ようやく その 警官 は 腕 を 下げ た 。,the the the the the the the the . . _EOS,40.503640854536876,0.18181818181818182,0.18181818181818182
152,we kept on working for hours without eating anything .,我々 は 何 も 食べ ず に 何 時間 も 働 き 続け た 。,we have to to to as as as . . _EOS,40.678453638352416,0.18181818181818182,0.2
153,we talked over our problems .,私 達 は 、 自ら の 問題 に つ い て 話し合 っ た 。,we _UNK on on the . . _EOS,28.32839162439293,0.25,0.3333333333333333
154,we had a very vigorous debate .,私 たち は とても 活発 な 討論 を し た 。,we were very very very _UNK . _EOS,4.145515593597557,0.375,0.42857142857142855
155,i prefer spring to fall .,秋 より 春 の ほう が 好き だ 。,i like like more than . _EOS,25.44909260922322,0.2857142857142857,0.3333333333333333
156,it is too far to go on foot from here to the hotel . better take a taxi .,ここ から ホテル まで 徒歩 で 行 く に は 遠 すぎ ま す 。 タクシー に お 乗 り なさ い 。,get on to to be go to the the the this this this . . . _EOS,33.309433636886034,0.4117647058823529,0.3684210526315789
157,everyone always speaks well of tony .,みんな いつ も トニー を ほめ る 。,i always always _UNK a . _EOS,84.18901681106105,0.2857142857142857,0.2857142857142857
158,all of these abilities are passed on to us by genetic transmission ; we receive them by way of the genes that we inherit from our parents .,後者 の 能力 は すべて 遺伝 に よ っ て 私 達 に 伝え られ る 。 つまり 、 親 から 受け つ ぐ 遺伝 子 を 通 し て 私 たち は そう し た 能力 を 受け取 る の で あ る 。,the _UNK of _UNK _UNK is to to to to to to to to to a a _UNK . .,42.133610178577094,0.2,0.14285714285714285
159,"in other words , i don &apos;t like to work with him .",言い換え れ ば 、 私 は 彼 と 働 き た く な い 。,"_UNK , i i to to to to to . . . _EOS",21.40653504933577,0.3076923076923077,0.3076923076923077
160,mike managed to carry the suitcase by himself .,マイク は なん と か その スーツケース を 一人 で 運 ん だ 。,what is the _UNK his his his &apos;s . _EOS,26.86834949369088,0.2,0.2222222222222222
161,we need the receipt mr smith signed .,私 たち は スミス さん が サイン し た 領収 書 が 必要 で す 。,we are have have the when when when the . . _EOS,44.6854966116049,0.25,0.375
162,they invited me to play cards .,彼 等 は トランプ を し な い か と 私 を 誘 っ て くれ た 。,they have me me a with . . _EOS,27.020399228848724,0.3333333333333333,0.42857142857142855
163,the sort of information we need is not always available .,私 たち が 必要 と する 情報 は 必ず しも 手 に 入 ら な い 。,we are not not but but _UNK _UNK . . _EOS,58.36291832739953,0.2727272727272727,0.2727272727272727
164,i helped an old lady across .,老 婦人 が 渡 る の を 助け た 。,i _UNK a _UNK _UNK . _EOS,54.788325947360164,0.2857142857142857,0.2857142857142857
165,"somehow , all those reasons sound rather far fetched .",何 か 、 全部 、 こじつけ って 感じ が する ん だ けど ・ ・ ・ 。,"what , , , , , _UNK _UNK _UNK _UNK _UNK _UNK _UNK . _EOS",119.7572820489927,0.13333333333333333,0.2
166,i entrusted my property to him .,彼 に 財産 管理 を 任せ た 。,i _UNK him him in in . . _EOS,27.2337478248199,0.3333333333333333,0.42857142857142855
167,we must take into account the wishes of all the family in planning a trip .,旅行 を 計画 する 場合 は 、 家族 全員 の 希望 を 考慮 す べ き だ 。,i should to the the the the to the the in . . . _EOS,50.897108571704464,0.26666666666666666,0.25
168,he dropped out when he was in the 7th grade .,彼 は 中一 の 時 学校 に 来 な く な っ た 。,he came back at at at at . _EOS,36.64638408950483,0.2222222222222222,0.18181818181818182
169,christmas is a good time to market new toys .,クリスマス は 新し い おもちゃ を うりだ す い い 機会 だ 。,you are to to to new new new . _EOS,22.513959190767537,0.3,0.3
170,i have been writing letters all morning .,私 は 午前 中 ずっと 手紙 を 書 い て い ま し た 。,i was to in in in in the the . _EOS,61.90452488767442,0.18181818181818182,0.25
171,the hotel is at the foot of a mountain .,その ホテル は 山 の ふもと に あ り ま す 。,the is is in in the the the . . _EOS,11.152754427333301,0.36363636363636365,0.4
172,i &apos;m putting up with him tomorrow .,明日 は 彼 の ところ に 泊ま る つもり だ 。,i will like him on tomorrow . . _EOS,16.600024440212955,0.4444444444444444,0.5
173,twenty @-@ five years from now there will be one retired person for each two working .,今 から ２５ 年 後 に は 、 就業 者 ２人 に つ き 退職 者 １人 の 割合 に な る だ ろ う 。,"it &apos;s to _UNK _UNK , , in the in the _UNK . . _EOS",116.9451803498728,0.06666666666666667,0.058823529411764705
174,she seems to have been happy .,彼女 は 幸せ で あ っ た よう だ 。,she was not _UNK _UNK . _EOS,11.606752629642347,0.2857142857142857,0.2857142857142857
175,the main crop of japan is rice .,日本 の 主要 作物 は 米 で あ る 。,japan are are the are are . . _EOS,25.976966322010544,0.3333333333333333,0.375
176,"everyone , whether an actual or potential patient .",患者 と 名 の つく すべて の 人 。,a is is is is _UNK . . _EOS,78.03501622948431,0.1111111111111111,0.1111111111111111
177,who am i ?,私 は 誰 な の だ ろ う か 。,how do come ? _EOS,12.44772536376951,0.2,0.25
178,i &apos;ll be waiting for you at the usual place .,いつ も の 場所 で 待 っ て い ま す 。,i always my my my . . _EOS,180.70900736049296,0.25,0.18181818181818182
179,the village is connected with our town by a bridge .,その 村 と 我々 の 町 は 橋 で つなが っ て い ま す 。,the my the the the the the the the the the the the . _EOS,90.46947102020519,0.13333333333333333,0.18181818181818182
180,warning - 18 + only .,十 八 禁 な の で 要 注意 ！,we the to the the the . _EOS,207.42172721606616,0.125,0.16666666666666666
181,i am leaving for the united states tomorrow .,私 は 明日 アメリカ へ 出発 する 予定 で す 。,i &apos;m to to to to america at school . _EOS,36.002174863593496,0.18181818181818182,0.2222222222222222
182,greek is difficult to learn .,ギリシャ 語 は 覚え にく い 。,there is is is _UNK . . _EOS,54.032674649090524,0.25,0.3333333333333333
183,i would like to go to austria in order to study music .,私 は 音楽 の 勉強 に オーストリア へ 行 き た い 。,i want to to to study study . _EOS,74.00917794604518,0.6666666666666666,0.46153846153846156
184,i received my bonus .,ボーナス を もら っ た 。,i had my _UNK _UNK . _EOS,10.723247504744194,0.42857142857142855,0.6
185,i like the way she laughs at my jokes .,私 は 私 の ジョーク を 聞 い て 笑 う 時 の 彼女 が 好き だ 。,i &apos;m to my my my my my my . . _EOS,42.51926817417735,0.25,0.3
186,i heard my name called from behind me .,自分 の 名前 が 後ろ から 呼 ば れ る の が きこえ た 。,i have to you from of of the . _EOS,34.36776457171695,0.3,0.3333333333333333
187,she has an eye for the beautiful .,彼女 は 審美 眼 を 持 っ て い る 。,she is a _UNK . _EOS,99.90950221629157,0.3333333333333333,0.25
188,the big ugly tree destroys the beauty of the house .,その 大きな 醜 い 木 が その 家 の 美観 を 損ね て い る 。,the _UNK _UNK the the the the _UNK . _EOS,18.68414634419936,0.4,0.36363636363636365
189,she fell ill a week ago .,彼女 は １ 週間 前 に 病気 に な っ た 。,she came her before before before before before . _EOS,39.03678236612411,0.2,0.2857142857142857
190,he is a frank person and easy to talk to .,彼 は ざっくばらん な 人柄 な の で 話 し やす い 。,he is not _UNK _UNK _UNK _UNK . . _EOS,29.871286702402983,0.3,0.2727272727272727
191,the garden is railed off from the path .,庭 は 柵 で 小道 と 仕切 ら れ て い る 。,the _UNK are _UNK with _UNK . . _EOS,28.078017192417267,0.2222222222222222,0.2222222222222222
192,i would like your picture .,君 の 写真 が 欲し い の で す が 。,i &apos;d like your your . _EOS,5.951313730269561,0.5714285714285714,0.6666666666666666
193,he has every reason to quit his job .,彼 が 仕事 を 辞め る の も もっとも だ 。,it is a that he he he is his . _EOS,48.8719651341221,0.2727272727272727,0.3333333333333333
194,put the book where you found it .,その 本 を もと あ っ た 所 へ 置 き なさ い 。,the the book the book you . _EOS,28.931819896070728,0.5,0.5
195,i never see this picture without being reminded of my childhood .,この 写真 を 見 る と 、 私 は 必ず 子供 の ころ を 思い出 す 。,i this to to to the the of the the . . _EOS,56.49636576374271,0.3076923076923077,0.3333333333333333
196,is this the right way to yokohama station ?,横浜 駅 へ 行 く の に は この 道 で い い の で す か 。,how &apos;s the the in in this here _EOS,19.71076986489775,0.2222222222222222,0.2222222222222222
197,he fell and broke his arm while he was skiing .,彼 は スキー を し て い る とき に 、 転 ん で 腕 を 折 っ た 。,he had a a a a a a a the the . . . _EOS,83.25101279758812,0.13333333333333333,0.18181818181818182
198,she gave me a look at her new car .,彼女 は 新車 を 見せ て くれ た 。,she was her her her . _EOS,48.076147057639844,0.42857142857142855,0.3
199,i &apos;d like to have mustard on the side .,マスタード を 別 に 持 っ て き て くださ い 。,please yourself me and _UNK . _EOS,121.07543874413416,0.14285714285714285,0.1
200,"come what may , i &apos;m ready for it .",何 が 起こ ろ う と も 、 その 覚悟 は でき て い ま す 。,i &apos;m all think the is is . _EOS,109.43163949694117,0.3333333333333333,0.3
201,he has been in hokkaido before .,彼 は 北海道 に い た こと が あ る 。,he is a of . . _EOS,26.421319869158335,0.2857142857142857,0.2857142857142857
202,his face and attitude showed the scorn he felt .,彼 の 顔つき や 態度 に は 軽蔑 の 気持ち が 表れ て い た 。,his _UNK was on on the the the . . _EOS,57.427410422139744,0.2727272727272727,0.3
203,"except for bill , they were all in time .",ビル 以外 は みな 間に合 っ た 。,the were were were for were . . _EOS,46.7951777970044,0.3333333333333333,0.3
204,parents are usually concerned about their children &apos;s future .,たいてい の 親 は 自分 の 子供 の 将来 が 気 に な る もの で す 。,the _UNK of of are are are . . _EOS,51.684122588942245,0.2,0.2
205,you know i can &apos;t .,そんな 事 でき な い の あなた 知 っ て で しょ う 。,what you you you such such such a such a . . _EOS,163.02629577474943,0.15384615384615385,0.3333333333333333
206,"one day , the police raided a whole group of prostitutes , and the girl was among them .",ある 日 の こと 、 警察 が 娼婦 の 集団 を 手入れ し た 。 少女 も その 集団 の 一員 だっ た 。,it was of was to was in was in was in day the day . . _EOS,71.29375955761788,0.29411764705882354,0.2631578947368421
207,where do you come from ?,どちら の ご 出身 で す か ？,is you you you ? ? _EOS,7.431811713021277,0.2857142857142857,0.3333333333333333
208,that altered the aspect of the case .,それ で 形勢 が 変わ っ た 。,it was in it . _EOS,132.63666356437912,0.16666666666666666,0.125
209,i &apos;ve got a bit of an ache in my back .,私 は 背中 が 少し 痛 い 。,i have a little little . _EOS,312.31325179837444,0.42857142857142855,0.25
210,my father &apos;s success counts for nothing to me .,父 の 成功 は 私 に 何 の 価値 も 無 い 。,my father is to me me . _EOS,72.64251816113408,0.625,0.5
211,i have a picture of an airport .,私 は 空港 の 写真 を 持 っ て い ま す 。,i have my my my my . . _EOS,25.673550526026307,0.3333333333333333,0.375
212,what do you intend to do ?,君 は 何 を する つもり な の 。,you will have your your . . _EOS,29.04588020226798,0.125,0.14285714285714285
213,this is as long as that .,これ と あれ は 同じ 長 さ で す 。,"this is , that will this . _EOS",8.516573929766505,0.5,0.5714285714285714
214,i read fifty pages further .,私 は 更 に ５０ ページ 読 ん だ 。,i like the the the the the . . _EOS,309.201136044319,0.2,0.3333333333333333
215,his misspelling of that word eliminated him from the contest .,その 語 の 綴り を 間違 っ て 、 彼 は コンテスト に 失格 し た 。,the the the _UNK the _UNK the . . _EOS,34.42608588631853,0.2,0.18181818181818182
216,math is the last subject that i want to study .,数学 は 私 が 最も 勉強 し た く な い 教科 で す 。,i will come come come come come come come come than . _EOS,69.57564380010855,0.15384615384615385,0.18181818181818182
217,he has acted wisely .,彼 は 賢明 に 行動 し た 。,he _UNK to the . . _EOS,50.24775530116487,0.2857142857142857,0.4
218,i want to surprise him .,私 は 彼 を あっ と 言 わ せ て や り た い 。,i want to to do you him him . . _EOS,70.43176578807447,0.45454545454545453,0.8333333333333334
219,you shouldn &apos;t eat anything cold .,冷た い 食事 は 、 避け て くださ い 。,please me me a a _UNK . _EOS,233.4885847889483,0.125,0.14285714285714285
220,he couldn &apos;t help laughing at it .,彼 は それ を 笑 わ ず に い られ な かっ た 。,he was not to it . _EOS,17.222801179524616,0.42857142857142855,0.375
221,quit lazing around and get moving !,グズグズ し て な い で さっさと 行動 しろ ！,don your your _UNK _UNK _UNK ! _EOS,74.09502642718564,0.125,0.14285714285714285
222,"japanese companies have set up factories on every continent , and japanese banks help finance many of the world &apos;s major economic programs .",日本 企業 は 全て の 大陸 に 工場 を 設立 し て い る し 、 日本 の 銀行 は 世界 の 主要 な 経済 計画 の 大国 財政 的 な 援助 を し て い る 。,japan japan a many many the the in in in in in the japan . _EOS,140.7004248428834,0.1875,0.125
223,"at last , we were home !",やっと 帰 っ て き た ぞ ！,it you you ! ! _EOS,160.1305604895008,0.16666666666666666,0.14285714285714285
224,in spring everything looks bright .,春 に は すべて の もの が 明る く 見え る 。,the man in in the the . _EOS,293.8386807128742,0.25,0.3333333333333333
225,"miyuki has a camera , but she doesn &apos;t like it .",美由紀 は カメラ を 持 っ て い る 、 しかし 彼女 は それ が 好き で な い 。,_UNK _UNK the to to but a a . . _EOS,54.89714378251882,0.2727272727272727,0.25
226,where &apos;s the nearest pharmacy ?,ここ から 一番 近 い 薬局 は どこ で す か 。,what &apos;s the the in ? ? ? ? _EOS,16.468835786295877,0.3,0.5
227,that &apos;s beside the point .,それ は 的外れ だ 。,it &apos;s a _UNK . _EOS,49.382901070928995,0.3333333333333333,0.3333333333333333
228,how long have you been waiting for the bus ?,バス を どの くらい お 待 ち で す か 。,how you the to a a bus ? _EOS,34.68334801067594,0.5555555555555556,0.5
229,he burst into tears .,彼 は 突然 わっと 泣 き 出 し た 。,he _UNK his with . . _EOS,23.546323084663072,0.2857142857142857,0.4
230,thomas could not carry out his task on account of an accident .,トーマス は 事故 の ため に 仕事 を やり遂げ られ な かっ た 。,_UNK was was _UNK in the the the the . _EOS,41.23393430491713,0.09090909090909091,0.07692307692307693
231,he stood apart from us .,彼 は 我々 から 離れ て 立 っ た 。,he got from from the . . _EOS,17.680955650349542,0.375,0.5
232,he doesn &apos;t travel much apart from occasional business trips .,彼 は 時々 出張 する こと は 別 と し て あまり 旅 を し な い 。,"he doesn &apos;t _UNK to to , a a a a . . . _EOS",28.528524877569797,0.26666666666666666,0.36363636363636365
233,he seemed worried about his health .,彼 は 体 を 心配 し て い る 様子 だっ た 。,he was hard with with . . _EOS,30.778381774679605,0.25,0.2857142857142857
234,she read the letter with her heart beating fast .,彼女 は 胸 を どきどき さ せ て 、 その 手紙 を 読 ん だ 。,she &apos;s the the the the the . . _EOS,23.545115272972275,0.3,0.3
235,"i &apos;m glad to meet you , too , mr ito .",私 も 伊藤 さん に お 目 に かか れ て 光栄 で す 。,i &apos;s the _UNK _UNK a a _UNK . . _EOS,39.198758403256164,0.18181818181818182,0.16666666666666666
236,he whispered slyly to me .,彼 は こっそり ささや い た 。,he was his _UNK . _EOS,7.4282475852846215,0.3333333333333333,0.3333333333333333
237,i have faith in your ability to do the right thing .,あなた は 正し い こと が でき る と 信 じ て い ま す 。,i am you you as as as . . _EOS,96.33618411308795,0.2,0.16666666666666666
238,i was surprised at you and your brother appearing on tv .,私 は 君 たち 兄弟 が テレビ に 出 て い て ビックリ し た 。,i was _UNK with with the the . . _EOS,52.33988564458434,0.3,0.25
239,will you excuse me for just a moment ?,ちょっと 失礼 し て よ い で しょ う か 。,how you you it it ? ? _EOS,57.87915649213269,0.25,0.2222222222222222
240,go ahead with your story .,どうぞ 話 を 続け て 下さ い 。,please yourself the the . . _EOS,37.65548027622611,0.14285714285714285,0.16666666666666666
241,they attributed the low death rate of infants to the progress of medicine .,彼 ら は 幼児 の 死亡 率 の 低 さ は 医学 の 進歩 の ゆえ と 考え た 。,they _UNK the _UNK _UNK _UNK _UNK _UNK _UNK . _EOS,49.396887079551156,0.2727272727272727,0.21428571428571427
242,excessive drinking is destructive of our health .,深酒 は 体 に よ く な い 。,_UNK is very very very . . _EOS,66.46730983695669,0.25,0.25
243,he is at home in american literature .,彼 は 米 文学 に 精通 し て い る 。,he is on to to on . . _EOS,21.64152081977733,0.3333333333333333,0.375
244,people used to laugh at him behind his back .,人々 は 陰 で 彼 を 嘲笑 し た もの だっ た 。,they _UNK him to to to the . . _EOS,39.60612136850867,0.3,0.3
245,the men have been shorn of their power .,彼 ら は 権限 を 剥奪 さ れ た 。,they was _UNK _UNK . . _EOS,486.057625222134,0.14285714285714285,0.1111111111111111
246,my tongue failed me .,私 は 口 が きけ な かっ た 。,i was not . . _EOS,104.29022588057764,0.16666666666666666,0.2
247,are you referring to me ?,君 は 僕 の こと を 言 っ て い る の か 。,how you know to your ? _EOS,9.4816857082312,0.42857142857142855,0.5
248,there was a murmur when she entered the room .,彼女 が 部屋 に は い っ た とき 、 ささやき が 聞こえ た 。,when was was was in room . . _EOS,34.23166407566261,0.4444444444444444,0.4
249,this is longer than any other bridge in the world .,これ は 世界 の どの 橋 より も 長 い 。,this is the the the the in the the . _EOS,18.14447253946923,0.45454545454545453,0.45454545454545453
250,we agreed among ourselves .,我々 は お 互い に 意見 が 一致 し た 。,we _UNK _UNK to our . . _EOS,126.97496521974128,0.25,0.4
251,i don &apos;t know which is which .,どっち が どっち な の か 分か ら な い 。,don &apos;t &apos;t who to _UNK . _EOS,24.87991212582817,0.375,0.375
252,patty is a smart student .,パティー は 利口 な 学生 だ 。,_UNK is a a a . . _EOS,10.247919298221458,0.375,0.5
253,christi &apos;s mysteries are most decidedly interesting .,クリスティー の 推理 小説 は 断然 面白 い 。,it is is the the the _UNK _UNK _UNK . _EOS,61.52959939734996,0.09090909090909091,0.125
254,we had much rain last year .,昨年 は 雨 が 多 かっ た 。,we had to rain rain in . _EOS,5.64472387847439,0.5,0.5714285714285714
255,did you feel the earth shake last night ?,ゆうべ 地震 を かん じ ま し た か 。,have you _UNK _UNK _UNK ? ? _EOS,31.585269548574665,0.25,0.2222222222222222
256,i really feel for you .,気持ち は よく 分か る よ 。,it &apos;s live today today . . _EOS,20.885497636679823,0.125,0.16666666666666666
257,he is too tall to stand straight in this room .,彼 は 背 が 高 すぎ て 、 この 部屋 で は まっすぐ に 立て な い 。,he is not but but this this in the room . . _EOS,16.224955788809904,0.46153846153846156,0.5454545454545454
258,"keisuke has always studied in this mansion . that style known as &apos; home schooling &apos; , right ?",啓介 さん は 、 この お 屋敷 で 、 ずっと お 勉強 し て い る ん で す 。 いわゆる ホーム スクーリング と い う 形 で す ね 。,_UNK is is a a _UNK _UNK this and this a a a _UNK . _EOS,85.87635876585769,0.125,0.10526315789473684
259,the hound was in full chase of the bear .,猟犬 は 熊 を 必死 に な っ て 追いかけ て い た 。,the _UNK was _UNK _UNK . . _EOS,27.65684176412182,0.375,0.3
260,people love to inspect each other &apos;s houses .,人 は 互い の 家 を 詳し く 調べ る の が 大好き だ 。,people is a to to people . _EOS,53.27077266811992,0.375,0.3333333333333333
